{
  "event_id": "11111111-1111-4111-8111-111111111111",
  "event_type": "document.sent",
  "occurred_at": "2026-07-27T18:00:00Z",
  "document_id": "22222222-2222-4222-8222-222222222222",
  "sender_organization_id": "33333333-3333-4333-8333-333333333333",
  "recipient_organization_id": "44444444-4444-4444-8444-444444444444",
  "actor_user_id": "55555555-5555-4555-8555-555555555555",
  "s3_bucket": "medibridge-test-documents",
  "s3_key": "documents/test-document.pdf",
  "correlation_id": "66666666-6666-4666-8666-666666666666"
}